{"channel":"stable","expires_at":"2026-09-20T00:00:00Z","generated_at":"2026-08-20T00:00:00Z","releases":[{"artifact_bytes":43,"artifact_sha256":"0365b8c5d9b48a3e930287d65643d9ee665a5ea6c62b77daf4933cd55d9ff32f","artifact_url":"https://releases.example.invalid/voice-agent-1.2.3-linux-x86_64-nvidia.tar.zst","build_id":"aaaaaaaaaaaaaaaaaaaaaaaaaaaaaaaaaaaaaaaa","manifest_sha256":"1500f525002a4fa605a26b23f2fbac71083962d96590abe253159cbd88c36812","maximum_data_schema":3,"minimum_data_schema":2,"minimum_launcher_protocol":1,"platform":"linux-x86_64-nvidia","version":"1.2.3"}],"schema":"voice-agent.channel.v1","sequence":7}